{
  "title": "「魔導兵器」使い捨て姫は、敵将に拾われて魔学院で逆転人生を謳歌する",
  "slug": "magic_weapon_disposable_princess_reversal_academy",
  "logline": "国から「起動不能の魔導兵器」として廃棄された使い捨て姫エルザは、敵対する帝国の冷徹な将軍に拾われ、その配下として魔法学院へ潜入する。彼女が持っているのは「誰にも使えない」呪われた魔力ではなく、あらゆる魔法を無効化し、物理的に武器に変える「絶対抗魔体質」。王族からの抹殺指令と、敵将の疑念という二重の危機の中で、彼女は「兵器」から「人間」へと変わり、最強のパートナーとの絆で王国の陰謀を暴く。",
  "genre": [
    "異世界ファンタジー",
    "スパイアクション",
    "バトル",
    "ロマンス"
  ],
  "target_audience": "20代〜30代の女性読者。『薬屋のひとりごと』のような知略サスペンスを好む層、『黒執事』や「ヴァンパイア騎士」のような主従から始まるスローボーンロマンスを愛する層。主人公が能動的に状況を変えていく展開と、冷徹な男性キャラとの心理戦を描く作品を求める読者。",
  "themes": [
    "アイデンティティの再構築",
    "支配と解放",
    "真実の愛とは",
    "戦後の再生"
  ],
  "selling_points": [
    "「使えない魔力」が実は最強の抗魔能力であり、敵の魔法を物理的に破壊して武器とするアクション描写。",
    "冷徹な敵将との「主従関係から始まる」疑心暗鬼の緊迫したロマンス。隙だらけの姫と完璧な将軍の対比。",
    "魔法学院という閉鎖空間でのスパイ活動。正体を隠しながらも、日常の中で少しずつ信頼を築いていく過程。",
    "王族による「兵器管理」の非人道性と、それに対抗する主人公たちのレジスタンス的な側面。"
  ],
  "world_summary": "大陸は二つの大国に分断されている。北の王国では、古代魔導技術を用いた「人柱兵器」として、特殊な魔力を持つ子供を生贄にすることで超兵器を完成させてきた。南の帝国はそれを非人道とし、魔法研究に重点を置いている。魔法学院は両国の国交維持のために設けられた中立地帯であり、双方の要人の子女が集まるが、実はスパイ活動の温床となっている。ここでは魔力の質よりも制御能力が重視され、王国的な血統主義とは異なる実力主義が敷かれている。",
  "world_rules": [
    "人柱兵器は自身の魔力を周囲に放出すると暴走するため、通常は感情抑制剤と特殊な拘束具で管理される。",
    "魔法学院では、個人の魔力の強弱ではなく、他者の魔法をいかに制御・無効化するかが評価基準の一部となっている。",
    "王国の「兵器」リストに登録された者は、国境を越えても追跡者（ハンター）によって抹殺の対象となる。",
    "敵将は帝国の最高司令官であり、彼の護衛であるエルザの存在は機密事項として扱われている。"
  ]
}